,title,company,description,location,job_posted
44,Data Analyst, Discover ,"Discover. A brighter future. With us, you'll do meaningful work from Day 1. Our collaborative culture is built on three core behaviors: We Play to Win, We Get Better Every Day & We Succeed Together. And we mean it - we want you to grow and make a difference at one of the world's leading digital banking and payments companies. We value what makes you unique so that you have an opportunity to shine. Come build your future, while being the reason millions of people find a brighter financial future "," Discover  Riverwoods, IL, USA",dice
45,Data Engineer , Tallon Recruiting & Staffing ,"Data Science Professionals TS/SCI FSP  VA, Chantilly 20151 Security Clearance: U.S. Citizen, Current Security Clearance, TS/SCI, Full Scope Polygraph Skills: Scripting, Data Parsing, ETL, Artificial Intelligence, Machine Learning, DevOps, SecDevOps, Python, SQL, Java  We are recruiting for multiple Data Scientist and Data Science Training positions supporting Intelligence Collections. Qualified candidates will have experience in one or more of the following: scripting, data parsing, ETL, artific"," Tallon Recruiting & Staffing  Chantilly, VA, USA",dice
46,Machine Learning, IGNW ,"Title: Technical Writer - Machine Learning, Data Science Location: Boston, MA Type: Contract To Perm Job #: KR302581614 Note: This job is not open to C2C or 3rd party candidates. IGNW is an engineering-based resourcing company headquartered in Portland, OR with GEO based teams in Seattle, WA / Austin & Dallas, TX / Southeast US / California. We have global partnerships to deliver the industry's top technical solutions and talent to every one of our clients. Some of our strategic partnerships inc"," IGNW  Boston, MA, USA",dice
47,Machine Learning, Deloitte ,"AVP, Data Science - Reinforcement Learning (RL) expert Are you interested in working in a dynamic environment that offers opportunities for professional growth and new responsibilities? If so, Deloitte & Touche LLP could be the place for you. At Deloitte, we are creating a world-class Artificial Intelligence and Machine Learning (AI/ML) Center of Excellence to enhance Deloitte's existing services and empower our clients to gain exponential value from their data. Our focus is on bringing data, an"," Deloitte  Phoenix, AZ, USA",dice
48,Machine Learning, Deloitte ,"AVP, Data Science - AI Graph Expert Are you interested in working in a dynamic environment that offers opportunities for professional growth and new responsibilities? If so, Deloitte & Touche LLP could be the place for you. At Deloitte, we are creating a world-class Artificial Intelligence and Machine Learning (AI/ML) Center of Excellence to enhance Deloitte's existing services and empower our clients to gain exponential value from their data. Our focus is on bringing data, analytics, and techno"," Deloitte  Phoenix, AZ, USA",dice
49,Data Analyst, Motion Recruitment ,"A company located right in the heart of the Orange County area is looking to bring on a mid-range data scientist engineers. They are currently working on several projects but by far the most critical one up to plate is building out a dynamic pricing revenue model to deploy across the country, with the accompanying data engineering pipelines and AWS lakes. They are looking for someone with a background building out statistical models and working within the data to create solutions for the busines"," Motion Recruitment  Irvine, CA, USA",dice
50,Data Scientist, Corus Consulting ,"We are looking for candidates that are able to manage Data without supervision, with high attention to details, with a LOGICAL approach and DATA modeling management experience.   Scorecard development would be a PLUS.   Languages: SQL, Python, R and SAS.     Job Information Job Title: Sr. Associate, Risk Modeling/Data Science Job Code:   Job Family: Risk Job Function: Risk Management Job Family Description: Monitors activities to minimize the company's exposure to risk. Activities may include qu"," Corus Consulting  Dallas, TX, USA",dice
51,Data Analyst, Accrete Hitech Solutions ,"looking for someone with more experience dealing with image dataLooking for ML Ops expert with the following skills, • Design, develop, deploy, and maintain production-grade scalable data transformation, machine learning and deep learning code, pipelines; manage data and model versioning, training, tuning, serving, experiment and evaluation tracking dashboards. • Manage ETL and machine learning model lifecycle: develop, deploy, monitor, maintain, and update data and models in production. • Build"," Accrete Hitech Solutions  Santa Clara, CA, USA",dice
52,Data Analyst, Discover ,"Discover. A brighter future. With us, you'll do meaningful work from Day 1. Our collaborative culture is built on three core behaviors: We Play to Win, We Get Better Every Day & We Succeed Together. And we mean it - we want you to grow and make a difference at one of the world's leading digital banking and payments companies. We value what makes you unique so that you have an opportunity to shine. Come build your future, while being the reason millions of people find a brighter financial future "," Discover  Riverwoods, IL, USA",dice
53,Data Analyst, Discover ,"Discover. A brighter future. With us, you'll do meaningful work from Day 1. Our collaborative culture is built on three core behaviors: We Play to Win, We Get Better Every Day & We Succeed Together. And we mean it - we want you to grow and make a difference at one of the world's leading digital banking and payments companies. We value what makes you unique so that you have an opportunity to shine. Come build your future, while being the reason millions of people find a brighter financial future "," Discover  Riverwoods, IL, USA",dice
54,Data Analyst, Discover ,"Discover. A brighter future. With us, you'll do meaningful work from Day 1. Our collaborative culture is built on three core behaviors: We Play to Win, We Get Better Every Day & We Succeed Together. And we mean it - we want you to grow and make a difference at one of the world's leading digital banking and payments companies. We value what makes you unique so that you have an opportunity to shine. Come build your future, while being the reason millions of people find a brighter financial future "," Discover  Riverwoods, IL, USA",dice
55,Data Analyst, TransUnion ,"What We'll Bring: At TransUnion, we have a welcoming and energetic environment that encourages collaboration and innovation we're - consistently exploring new technologies and tools to be agile. This environment gives our people the opportunity to hone current skills and build new capabilities, while discovering their genius. Come be a part of our team - you'll work with great people, pioneering products and cutting-edge technology. What You'll Bring: A graduate degree in the hard sciences with "," TransUnion  Chicago, IL, USA",dice
56,Data Scientist, DISQO ,"DISQO is changing the way that the world's largest brands, agencies and consumer intelligence companies get to know their consumers. We've built the first identity-based platform that combines consumer attitudes and behaviors together to power the most accurate and predictive insights solutions for our customers, and we do all of that with the willing participation of our consumers and without using outdated technologies like third-party cookies. We help our customers get a cross-platform view i"," DISQO  Glendale, CA, USA",dice
57,Data Analyst, OMG Technologies ,"Role: Data Science/Data Engineering Consultant with Strong Pharmaceutical Commercial Data Experience  We are looking to hire a consultant with the below skills set and experience for one of our clients within the Pharmaceutical industry, a major pharmaceutical company. This is 6-months Contract opportunity with a potential to get extended or hired at the end of the contracting period. Interested candidates may share updated resume to Carolina - OMG Technologies.com *Ideal Candidate is an establi"," OMG Technologies  Princeton, NJ, USA",dice
58,Data Scientist, Fannie Mae ,"Company Description  At Fannie Mae, futures are made. The inspiring work we do makes an affordable home a reality and a difference in the lives of Americans. Every day offers compelling opportunities to modernize the nation's housing finance system while being part of an inclusive team using new, emerging technologies. Here, you will help lead our industry forward, enhance your technical expertise, and make your career.  Job Description  As a valued leader on our team, you will manage staff who "," Fannie Mae  Reston, VA, USA",dice
59,Data Scientist, TransUnion ,"What We'll Bring: At TransUnion, we have a welcoming and energetic environment that encourages collaboration and innovation.  We are consistently exploring new technologies and tools to be agile. This environment gives our people the opportunity to hone current skills and build new capabilities, while discovering their genius. Come be a part of our team - you'll work with great people, pioneering products and cutting-edge technology.  Protecting the health and wellness of our associates and cand"," TransUnion  Chicago, IL, USA",dice
60,Data Engineer , Discover ,"Discover. A brighter future. With us, you'll do meaningful work from Day 1. Our collaborative culture is built on three core behaviors: We Play to Win, We Get Better Every Day & We Succeed Together. And we mean it - we want you to grow and make a difference at one of the world's leading digital banking and payments companies. We value what makes you unique so that you have an opportunity to shine. Come build your future, while being the reason millions of people find a brighter financial future "," Discover  Riverwoods, IL, USA",dice
61,Data Analyst, DISQO ,"DISQO is changing the way that the world's largest brands, agencies and consumer intelligence companies get to know their consumers. We've built the first identity-based platform that combines consumer attitudes and behaviors together to power the most accurate and predictive insights solutions for our customers, and we do all of that with the willing participation of our consumers and without using outdated technologies like third-party cookies. We help our customers get a cross-platform view i", DISQO  Remote,dice
62,Data Scientist, Boehringer Ingelheim ,"Description: Description\: As a member of the IT Research, Development & Medicine (RDM) Biometry & Data Science team, the IT Business Consultant II serves as a trusted advisor to the global Animal Health and Human Pharma business functions acting as the primary point of contact and interface between the IT department and key stakeholders throughout the lifecycle of short-term and long-term projects. The IT Business Consultant II represents Boehringer Ingelheim IT to the business functions, promo"," Boehringer Ingelheim  Ridgefield, CT, USA",dice
63,Data Analyst, Fiserv ,"Technology Analyst Program - Cyber, Infrastructure, Data Science, IT Project Management -Alpharetta / Marietta Fiserv's Technology Analyst Program is an early career development program where candidates experience two one-year assignments in a core functional technology role. Each assignment builds upon the other and together will provide a breadth of experience in the business world and unique to you! We are looking for university graduates with drive, passion, and an evolving target for their "," Fiserv  Alpharetta, GA, USA",dice
64,Data Scientist, Wizard Tech Solutions Inc ,"Some examples of what you'll be doing: Develop strong collaborative partnerships with business and operations leadersUse compelling data, deep business acumen and exceptional communication to drive business strategy and executionIdentify business challenges, performance bottlenecks and growth opportunitiesConduct insightful analyses on major trends, thinking 3 steps ahead to guide emerging strategyPropose rapid experiments to test the effect of new strategies or initiatives, and iterate quicklyC"," Wizard Tech Solutions Inc  Austin, TX, USA",dice
65,Data Scientist, comScore ,"April 15, 2021  Data Scientist, Panel Science Job Description  Job Title: Data Scientist, Panel Science Location:  Chicago, IL  About this Role: Comscore is a leading big data technology company that measures what matters to make cross-platform audiences and advertising more valuable. We are seeking a Data Scientist, Panel Science to mine our large-scale global consumer panel data sets and provide insights to help inform our methodologies and data insights around the world. The Data Scientist wi"," comScore  Chicago, IL, USA",dice
66,Data Engineer , ADNET Systems ,"ES194 Earth Scie  nce Data Specialist The NASA Earth Science Data and Information Systems (ESDIS) project, headquartered at the Goddard Space Flight Center, supports data systems operations for centers across the US. This includes processing, archival and distribution of data from dozens of instruments over a span of more than 40 years. The data is used for research and applications in a myriad of fields including land processes, oceanographic and atmospheric sciences. This particular task suppo"," ADNET Systems  Lanham, MD, USA",dice
67,Data Scientist, Baker Hughes Energy Services LLC ,"Partner with the best  As Head of Data Science & Analytics you will lead a talented data science team and deliver transformational customer insights leveraging digital footprint of the business, installed base and data assets in alignment with the business's overall vision. This is a key leadership position responsible for the creation of new data sciences applications for the customers by envisioning and executing strategies that will influence improvement of the asset and enterprise performanc"," Baker Hughes Energy Services LLC  Minden, NV, USA",dice
68,Data Analyst, Deloitte ,"Life Sciences Manager - Data Analytics  Work you'll do  A Manager at Deloitte will manage and deliver components of client engagements that design and implement technology-based business solutions for large multi-national organizations. Key responsibilities will include:  Manage teams in the identification of business requirements, functional design, process design (including scenario design, flow mapping), prototyping, testing, training, defining support procedures.Formulate planning, budgeting"," Deloitte  Los Angeles, CA, USA",dice
